<?xml version="1.0" ?>
<!-- =================================================================================== -->
<!-- |    This document was autogenerated by xacro from /home/lsa/ocean2/src/underwater_simulation/uwsim/data/scenes/xacroExample.xml.xacro | -->
<!-- |    EDITING THIS FILE BY HAND IS NOT RECOMMENDED                                 | -->
<!-- =================================================================================== -->
<!DOCTYPE UWSimScene
  SYSTEM 'UWSimScene.dtd'>
<UWSimScene xmlns:xacro="http://www.ros.org/wiki/xacro">
  <!-- oceanState macros -->
  <!-- simParameters macros -->
  <!-- camera macros -->
  <!-- vehicle macros -->
  <!-- AFAIK: There is no simple way to create a xacro macro for jointValues. -->
  <!-- <xacro:macro name="_joints">
<jointValues>
  <joint> 0 </joint>
  <joint> 0</joint>
  <joint> 2.2 </joint>
  <joint> 0 </joint>
  <joint>0.3 </joint>
</jointValues>
</xacro:macro> -->
  <!-- Virtual cameras macros -->
  <!-- Structured light projectors macros -->
  <!-- range sensor macros -->
  <!--Object picker macros -->
  <!-- imu macros -->
  <!--pressureSensor macros -->
  <!--gpsSensor macros -->
  <!--dvlSensor macros -->
  <!-- Virtual range image macros -->
  <!-- multibeam sensor macros -->
  <!-- Force sensor macros -->
  <!-- Dredge Tool macros -->
  <!-- Object macros -->
  <!-- Ros interfaces macros -->
  <!-- oceanState macros -->
  <!-- simParameters macros -->
  <!-- camera macros -->
  <!-- vehicle macros -->
  <!-- AFAIK: There is no simple way to create a xacro macro for jointValues. -->
  <!-- <xacro:macro name="_joints">
<jointValues>
  <joint> 0 </joint>
  <joint> 0</joint>
  <joint> 2.2 </joint>
  <joint> 0 </joint>
  <joint>0.3 </joint>
</jointValues>
</xacro:macro> -->
  <!-- Virtual cameras macros -->
  <!-- Structured light projectors macros -->
  <!-- range sensor macros -->
  <!--Object picker macros -->
  <!-- imu macros -->
  <!--pressureSensor macros -->
  <!--gpsSensor macros -->
  <!--dvlSensor macros -->
  <!-- Virtual range image macros -->
  <!-- multibeam sensor macros -->
  <!-- Force sensor macros -->
  <!-- Dredge Tool macros -->
  <!-- Object macros -->
  <!-- Ros interfaces macros -->
  <!-- oceanState macros -->
  <!-- simParameters macros -->
  <!-- camera macros -->
  <!-- vehicle macros -->
  <!-- AFAIK: There is no simple way to create a xacro macro for jointValues. -->
  <!-- <xacro:macro name="_joints">
<jointValues>
  <joint> 0 </joint>
  <joint> 0</joint>
  <joint> 2.2 </joint>
  <joint> 0 </joint>
  <joint>0.3 </joint>
</jointValues>
</xacro:macro> -->
  <!-- Virtual cameras macros -->
  <!-- Structured light projectors macros -->
  <!-- range sensor macros -->
  <!--Object picker macros -->
  <!-- imu macros -->
  <!--pressureSensor macros -->
  <!--gpsSensor macros -->
  <!--dvlSensor macros -->
  <!-- Virtual range image macros -->
  <!-- multibeam sensor macros -->
  <!-- Force sensor macros -->
  <!-- Dredge Tool macros -->
  <!-- Object macros -->
  <!-- Ros interfaces macros -->
  <!-- oceanState macros -->
  <!-- simParameters macros -->
  <!-- camera macros -->
  <!-- vehicle macros -->
  <!-- AFAIK: There is no simple way to create a xacro macro for jointValues. -->
  <!-- <xacro:macro name="_joints">
<jointValues>
  <joint> 0 </joint>
  <joint> 0</joint>
  <joint> 2.2 </joint>
  <joint> 0 </joint>
  <joint>0.3 </joint>
</jointValues>
</xacro:macro> -->
  <!-- Virtual cameras macros -->
  <!-- Structured light projectors macros -->
  <!-- range sensor macros -->
  <!--Object picker macros -->
  <!-- imu macros -->
  <!--pressureSensor macros -->
  <!--gpsSensor macros -->
  <!--dvlSensor macros -->
  <!-- Virtual range image macros -->
  <!-- multibeam sensor macros -->
  <!-- Force sensor macros -->
  <!-- Dredge Tool macros -->
  <!-- Object macros -->
  <!-- Ros interfaces macros -->
  <oceanState>
    <windx> 0.04 </windx>
    <windy> 0.04 </windy>
    <windSpeed> 12 </windSpeed>
    <depth> 1000 </depth>
    <reflectionDamping> 0.35 </reflectionDamping>
    <waveScale> 1e-07 </waveScale>
    <isNotChoppy> 0 </isNotChoppy>
    <choppyFactor> 2.5 </choppyFactor>
    <crestFoamHeight> 2.2 </crestFoamHeight>
    <oceanSurfaceHeight> 0 </oceanSurfaceHeight>
    <fog>
      <density> 0.1</density>
      <color>
        <r>0</r>
        <g>0.05</g>
        <b>0.3</b>
      </color>
    </fog>
    <color>
      <r>0.0</r>
      <g>0.05</g>
      <b>0.3</b>
    </color>
    <attenuation>
      <r>0.015</r>
      <g>0.0075</g>
      <b>0.005</b>
    </attenuation>
  </oceanState>
  <simParams>
    <disableShaders> 0 </disableShaders>
    <resw> 800 </resw>
    <resh> 600 </resh>
    <offsetp>
      <x>0</x>
      <y>0</y>
      <z>0</z>
    </offsetp>
    <offsetr>
      <x>3.141592654</x>
      <y>0</y>
      <z>-1.570796327</z>
    </offsetr>
    <enablePhysics> 0 </enablePhysics>
  </simParams>
  <camera>
    <freeMotion> 1 </freeMotion>
    <objectToTrack>girona500/base_link</objectToTrack>
    <fov> 60 </fov>
    <aspectRatio> 1.33 </aspectRatio>
    <near> 0.1 </near>
    <far> 10000 </far>
    <position>
      <x>-5</x>
      <y>-5</y>
      <z>8</z>
    </position>
    <lookAt>
      <x>0</x>
      <y>0</y>
      <z>0</z>
    </lookAt>
  </camera>
  <vehicle>
    <name>girona500</name>
    <file>data/scenes/g500ARM5.urdf</file>
    <jointValues>
      <joint> 0 </joint>
      <joint> 0</joint>
      <joint> 2.2 </joint>
      <joint> 0 </joint>
      <joint>0.3 </joint>
    </jointValues>
    <position>
      <x>0.2</x>
      <y>0</y>
      <z>2.0</z>
    </position>
    <orientation>
      <r>0</r>
      <p>0</p>
      <y>0</y>
    </orientation>
    <scaleFactor>
      <x>1</x>
      <y>1</y>
      <z>1</z>
    </scaleFactor>
    <virtualCamera>
      <name>bowtech1</name>
      <relativeTo>part0</relativeTo>
      <resw> 320</resw>
      <resh> 240</resh>
      <position>
        <x>-0.2</x>
        <y>-0.1</y>
        <z>0</z>
      </position>
      <orientation>
        <r>0</r>
        <p>3.141592654</p>
        <y>1.570796327</y>
      </orientation>
      <baseline>0</baseline>
      <frameId></frameId>
      <fovy>50</fovy>
      <showpath>0</showpath>
      <grayscale>0</grayscale>
      <std>0.005</std>
    </virtualCamera>
    <multibeamSensor>
      <name>multibeam</name>
      <relativeTo>part0</relativeTo>
      <visible>0</visible>
      <position>
        <x>-0.2</x>
        <y>0.1</y>
        <z>0</z>
      </position>
      <orientation>
        <r>3.141592654</r>
        <p>0</p>
        <y>3.141592654</y>
      </orientation>
      <initAngle>-60</initAngle>
      <finalAngle>60</finalAngle>
      <angleIncr>0.1</angleIncr>
      <range>10</range>
    </multibeamSensor>
  </vehicle>
  <object>
    <name>terrain</name>
    <file>terrain/CIRS/cirs_trident.osg</file>
    <position>
      <x>0</x>
      <y>0</y>
      <z>0</z>
    </position>
    <orientation>
      <r>0</r>
      <p>0</p>
      <y>0</y>
    </orientation>
    <scaleFactor>
      <x>1</x>
      <y>1</y>
      <z>1</z>
    </scaleFactor>
    <offsetp>
      <x>-1.5</x>
      <y>-3.0</y>
      <z>0</z>
    </offsetp>
    <offsetr>
      <x>3.141592654</x>
      <y>0</y>
      <z>-1.570796327</z>
    </offsetr>
    <physics>
      <mass> 0 </mass>
      <collisionShapeType>trimesh</collisionShapeType>
    </physics>
  </object>
  <object>
    <name>blackbox</name>
    <file>objects/blackbox_uib_trimesh.osg</file>
    <position>
      <x>0</x>
      <y>0</y>
      <z>4.7</z>
    </position>
    <orientation>
      <r>0</r>
      <p>3.141592654</p>
      <y>0</y>
    </orientation>
    <scaleFactor>
      <x>1</x>
      <y>1</y>
      <z>1</z>
    </scaleFactor>
    <offsetp>
      <x>0</x>
      <y>0</y>
      <z>0</z>
    </offsetp>
    <offsetr>
      <x>0</x>
      <y>0</y>
      <z>0</z>
    </offsetr>
    <physics>
      <mass> 15 </mass>
      <collisionShapeType>box</collisionShapeType>
    </physics>
  </object>
  <rosInterfaces>
    <ROSOdomToPAT>
      <topic> /dataNavigator </topic>
      <vehicleName> girona500 </vehicleName>
    </ROSOdomToPAT>
    <WorldToROSTF>
      <rootName> /world </rootName>
      <enableObjects> 1 </enableObjects>
    </WorldToROSTF>
    <ArmToROSJointState>
      <topic> /uwsim/joint_state </topic>
      <vehicleName> girona500 </vehicleName>
    </ArmToROSJointState>
    <ROSJointStateToArm>
      <topic> /uwsim/joint_state_command </topic>
      <vehicleName> girona500 </vehicleName>
    </ROSJointStateToArm>
    <VirtualCameraToROSImage>
      <cameraName> bowtech1 </cameraName>
      <imageTopic> /uwsim/camera1 </imageTopic>
      <infoTopic> /uwsim/camera1_info </infoTopic>
    </VirtualCameraToROSImage>
    <multibeamSensorToLaserScan>
      <name> multibeam </name>
      <topic> g500/multibeam </topic>
    </multibeamSensorToLaserScan>
  </rosInterfaces>
</UWSimScene>
