<?xml version="1.0"?>

<!DOCTYPE UWSimScene SYSTEM "UWSimScene.dtd" >

<UWSimScene>
  <oceanState>
    <windx> 1.0 </windx>
    <windy> 1.0 </windy>
    <windSpeed> 5.5 </windSpeed>
    <depth> 10000 </depth>
    <reflectionDamping> 0.35 </reflectionDamping>
    <waveScale> 5e-8 </waveScale>
    <isNotChoppy> 0 </isNotChoppy>
    <choppyFactor> -2.5 </choppyFactor>
    <crestFoamHeight> 2.2 </crestFoamHeight>
    <oceanSurfaceHeight> 1 </oceanSurfaceHeight>
    <fog>
      <density> 0.1 </density>
      <color>
        <r>0.017</r>
        <g>0.027</g>
        <b>0.079</b>
      </color>
    </fog>
    <color>
        <r>0.55</r>
        <g>0.45</g>
        <b>0.33</b>
    </color>
    <attenuation>
      <r>0.15</r>
      <g>0.15 </g>
      <b> 0.05 </b>
    </attenuation>
  </oceanState>
  
  <simParams>
    <disableShaders> 0 </disableShaders>
    <resw> 1152 </resw>
    <resh> 864 </resh>
  </simParams>

  <camera>
    <freeMotion> 1 </freeMotion>
    <objectToTrack>airboat/base_link</objectToTrack>
    <fov> 60 </fov>
    <aspectRatio> 1.33 </aspectRatio>
    <near> 1 </near>
    <far> 10000 </far>
    <position>
      <x>240</x>
      <y>82.5 </y>
      <z>25 </z>
    </position> 
    <lookAt>
      <x>260</x>
      <y>82.5 </y>
      <z>5 </z>
    </lookAt>
  </camera>

  <vehicle>
    <name>airboat</name>
    <file>urdf/airboat_uwsim.urdf</file>
    <jointValues>
      <joint> 0 </joint>
      <joint> 0 </joint>
    </jointValues>
     <position>
      <x> 250</x>
      <y> 95 </y>
      <z> 1 </z>
    </position>
    <orientation>
      <r>0 </r>
      <p>0 </p>
      <y>0 </y>
    </orientation>
  </vehicle>
  


   <vehicle>
    <name>buoy1</name>
    <file>urdf/buoy_uwsim.urdf</file>
    <position>
      <x> 250</x>
      <y> 100 </y>
      <z> 1 </z>
    </position>
    <orientation>
      <r>0</r>
      <p>0</p>
      <y>0</y>
    </orientation>
  </vehicle>
  
   <vehicle>
    <name>buoy2</name>
    <file>urdf/buoy_uwsim.urdf</file>
    <position>
      <x> 285</x>
      <y> 100 </y>
      <z> 1 </z>
    </position>
    <orientation>
      <r>0</r>
      <p>0</p>
      <y>0</y>
    </orientation>
  </vehicle>

   <vehicle>
    <name>buoy3</name>
    <file>urdf/buoy_uwsim.urdf</file>

    <position>
      <x> 250</x>
      <y> 65 </y>
      <z> 1 </z>
    </position>
    <orientation>
      <r>0</r>
      <p>0</p>
      <y>0</y>
    </orientation>
  </vehicle>

   <vehicle>
    <name>buoy4</name>
    <file>urdf/buoy_uwsim.urdf</file>

    <position>
      <x> 285</x>
      <y> 65 </y>
      <z> 1 </z>
    </position>
    <orientation>
      <r>0</r>
      <p>0</p>
      <y>0</y>
    </orientation>
  </vehicle>


	<object>
    <name>terrain</name>
    <file>terrain/diluvio5/novo4.obj</file>
    <position>
      <x> 0</x>
      <y> 558 </y>
      <z> 0 </z>
    </position>
    <orientation>
      <r>0</r>
      <p>0 </p>
      <y>0 </y>
    </orientation>
  </object>

  <rosInterfaces>   

    <ROSOdomToPAT>
      <topic> /airboat/state </topic>
      <vehicleName> airboat </vehicleName>
    </ROSOdomToPAT>

    <ROSOdomToPAT>
      <topic> /buoy1/state </topic>
      <vehicleName> buoy1 </vehicleName>
    </ROSOdomToPAT> 
    
    <ROSOdomToPAT>
      <topic> /buoy2/state </topic>
      <vehicleName> buoy2 </vehicleName>
    </ROSOdomToPAT> 
    
    <ROSOdomToPAT>
      <topic> /buoy3/state </topic>
      <vehicleName> buoy3 </vehicleName>
    </ROSOdomToPAT>    
    
    <ROSOdomToPAT>
      <topic> /buoy4/state </topic>
      <vehicleName> buoy4 </vehicleName>
    </ROSOdomToPAT> 

	<OceanSurfaceToROSOceanVehicle>
	<topic>/airboat/Surface/base_link</topic>
	<vehicleName>airboat</vehicleName>
	<linkName>base_link</linkName>
    </OceanSurfaceToROSOceanVehicle>  

	<OceanSurfaceToROSOceanVehicle>
	<topic>/airboat/Surface/center_r_link</topic>
	<vehicleName>airboat</vehicleName>
	<linkName>center_r_link</linkName>
    </OceanSurfaceToROSOceanVehicle>  

    <OceanSurfaceToROSOceanVehicle>
	<topic>/airboat/Surface/back_r_link</topic>
	<vehicleName>airboat</vehicleName>
	<linkName>back_r_link</linkName>
    </OceanSurfaceToROSOceanVehicle>  
    
    <OceanSurfaceToROSOceanVehicle>
	<topic>/airboat/Surface/back_l_link</topic>
	<vehicleName>airboat</vehicleName>
	<linkName>back_l_link</linkName>
    </OceanSurfaceToROSOceanVehicle>  

    <OceanSurfaceToROSOceanVehicle>
	<topic>/airboat/Surface/front_r_link</topic>
	<vehicleName>airboat</vehicleName>
	<linkName>front_r_link</linkName>
    </OceanSurfaceToROSOceanVehicle>  
    
    <OceanSurfaceToROSOceanVehicle>
	<topic>/airboat/Surface/front_l_link</topic>
	<vehicleName>airboat</vehicleName>
	<linkName>front_l_link</linkName>
    </OceanSurfaceToROSOceanVehicle> 
   
     <OceanSurfaceToROSOceanVehicle>
	<topic>/airboat/Surface/fwd</topic>
	<vehicleName>airboat</vehicleName>
	<linkName>fwd</linkName>
    </OceanSurfaceToROSOceanVehicle>  
     
    <OceanSurfaceToROSOceanVehicle>
	<topic>/buoy1/Surface/link</topic>
	<vehicleName>buoy1</vehicleName>
	<linkName>link</linkName>
    </OceanSurfaceToROSOceanVehicle>
    
    <OceanSurfaceToROSOceanVehicle>
	<topic>/buoy2/Surface/link</topic>
	<vehicleName>buoy2</vehicleName>
	<linkName>link</linkName>
    </OceanSurfaceToROSOceanVehicle> 
    
    <OceanSurfaceToROSOceanVehicle>
	<topic>/buoy3/Surface/link</topic>
	<vehicleName>buoy3</vehicleName>
	<linkName>link</linkName>
    </OceanSurfaceToROSOceanVehicle>  


    <OceanSurfaceToROSOceanVehicle>
	<topic>/buoy4/Surface/link</topic>
	<vehicleName>buoy4</vehicleName>
	<linkName>link</linkName>
    </OceanSurfaceToROSOceanVehicle>
        
	<ROSJointStateToArm> 
   		<topic>/airboat/joint_states</topic>
   		<vehicleName>airboat</vehicleName>
   	</ROSJointStateToArm>

  </rosInterfaces>
</UWSimScene>

