<?xml version="1.0"?>

<!DOCTYPE UWSimScene SYSTEM "UWSimScene.dtd" >

<UWSimScene>
  <oceanState>
    <windx> 1 </windx>
    <windy> 1 </windy>
    <windSpeed> 2.2 </windSpeed>
    <depth> 10000 </depth>
    <reflectionDamping> 0.35 </reflectionDamping>
    <waveScale> 1e-7 </waveScale>
    <isNotChoppy> 0 </isNotChoppy>
    <choppyFactor> -2.5 </choppyFactor>
    <crestFoamHeight> 2.2 </crestFoamHeight>
    <oceanSurfaceHeight> 1 </oceanSurfaceHeight>
    <fog>
      <density> 0.1 </density>
      <color>
        <r>0.017</r>
        <g>0.027</g>
        <b>0.079</b>
      </color>
    </fog>
    <color>
        <r>0.55</r>
        <g>0.45</g>
        <b>0.33</b>
    </color>
    <attenuation>
      <r>0.15</r>
      <g>0.15 </g>
      <b> 0.05 </b>
    </attenuation>
  </oceanState>
  
  <simParams>
    <disableShaders> 0 </disableShaders>
    <resw> 1152 </resw>
    <resh> 864 </resh>
  </simParams>

  <camera>
    <freeMotion> 1 </freeMotion>
    <objectToTrack>sailboat/base_link</objectToTrack>
    <fov> 60 </fov>
    <aspectRatio> 1.33 </aspectRatio>
    <near> 1 </near>
    <far> 10000 </far>
    <position>
      <x>135</x>
      <y>150 </y>
      <z>15 </z>
    </position> 
    <lookAt>
      <x>145</x>
      <y>150 </y>
      <z>5 </z>
    </lookAt>
  </camera>

  <vehicle>
    <name>sailboat</name>
    <file>urdf/sailboat_uwsim.urdf</file>
    <jointValues>
      <joint> 0 </joint>
      <joint> 0 </joint>
    </jointValues>
     <position>
      <x> 145 </x>
      <y> 150 </y>
      <z> 1.13 </z>
    </position>
    <orientation>
      <r>0 </r>
      <p>0 </p>
      <y>0 </y>
    </orientation>
  </vehicle>

  <rosInterfaces>   

    <ROSOdomToPAT>
      <topic> /sailboat/state </topic>
      <vehicleName> sailboat </vehicleName>
    </ROSOdomToPAT>

	<OceanSurfaceToROSOceanVehicle>
	<topic>/sailboat/Surface/base_link</topic>
	<vehicleName>sailboat</vehicleName>
	<linkName>base_link</linkName>
    </OceanSurfaceToROSOceanVehicle>  

	<OceanSurfaceToROSOceanVehicle>
	<topic>/sailboat/Surface/center_r_link</topic>
	<vehicleName>sailboat</vehicleName>
	<linkName>center_r_link</linkName>
    </OceanSurfaceToROSOceanVehicle>  

    <OceanSurfaceToROSOceanVehicle>
	<topic>/sailboat/Surface/back_r_link</topic>
	<vehicleName>sailboat</vehicleName>
	<linkName>back_r_link</linkName>
    </OceanSurfaceToROSOceanVehicle>  
    
    <OceanSurfaceToROSOceanVehicle>
	<topic>/sailboat/Surface/back_l_link</topic>
	<vehicleName>sailboat</vehicleName>
	<linkName>back_l_link</linkName>
    </OceanSurfaceToROSOceanVehicle>  

    <OceanSurfaceToROSOceanVehicle>
	<topic>/sailboat/Surface/front_r_link</topic>
	<vehicleName>sailboat</vehicleName>
	<linkName>front_r_link</linkName>
    </OceanSurfaceToROSOceanVehicle>  
    
    <OceanSurfaceToROSOceanVehicle>
	<topic>/sailboat/Surface/front_l_link</topic>
	<vehicleName>sailboat</vehicleName>
	<linkName>front_l_link</linkName>
    </OceanSurfaceToROSOceanVehicle>  
        
	<ROSJointStateToArm> 
   		<topic>/sailboat/joint_states</topic>
   		<vehicleName>sailboat</vehicleName>
   	</ROSJointStateToArm>

  </rosInterfaces>
</UWSimScene>

